{"limit_policy_version":"1.0","minimum_reader_version":"0.2.0","not_claimed":["arbitrary_read_confinement","egress_denial"],"policy_version":"1.0","record_digest":"976d5f1e5270d08c6861f72dc96d888cad39c9798201fe50747691ebed0c66a5","required":["credential_isolation","process_tree_termination","profile_redirection","temporary_root_redirection","writable_confinement"],"schema_digest":"dcdf065657cb09ca940efdc209a7e2c28b6bbf7bdb38316b37d3ae1f66d8014c","schema_version":"1.0","writer_version":"0.2.0"}
